<?xml version="1.1" encoding="UTF-8" standalone="yes"?>

<xsd:schema xmlns:xsd="http://www.w3.org/2001/XMLSchema">
    <xsd:complexType name="T_Personne">
        <xsd:sequence>
            <xsd:element ref="nom"/>
            <xsd:element ref="prénom"/>
            <xsd:element ref="date-naissance"/>
        </xsd:sequence>
    </xsd:complexType>
    <xsd:element name="formation">
        <xsd:complexType>
            <xsd:sequence>
                <xsd:element ref="nom"/>
                <xsd:element ref="eleves"/>
                <xsd:element ref="matières"/>
            </xsd:sequence>
        </xsd:complexType>
    </xsd:element>    
    <xsd:element name="nom" type="xsd:string"/>
    <xsd:element name="prénom" type="xsd:string"/>
    <xsd:element name="date-naissance" type="xsd:date"/>
    <xsd:element name="eleves">
        <xsd:complexType>
            <xsd:sequence>
                <xsd:element ref="eleve" maxOccurs="14"/>
            </xsd:sequence>
        </xsd:complexType>
    </xsd:element>
    <xsd:element name="eleve" type="T_Personne"/>
    <xsd:element name="matières">
        <xsd:complexType>
            <xsd:sequence>
                <xsd:element ref="cours" minOccurs="0" maxOccurs="unbounded"/>
            </xsd:sequence>
        </xsd:complexType>
    </xsd:element>
    <xsd:element name="cours">
        <xsd:complexType>
            <xsd:sequence>
                <xsd:element ref="nom"/>
                <xsd:element ref="professeur" />
            </xsd:sequence>
        </xsd:complexType>
    </xsd:element>
    <xsd:element name="professeur" type="T_Personne"/>
</xsd:schema>